{
  "schema_version": "1.0",
  "job_revision_id": "44444444-4444-4444-8444-444444444444",
  "backend": "slurm",
  "adapter_version": "slurm-ssh/v1",
  "helper_sha256": "eeeeeeeeeeeeeeeeeeeeeeeeeeeeeeeeeeeeeeeeeeeeeeeeeeeeeeeeeeeeeeee",
  "profile_revision": 1,
  "request": {
    "schema_version": "1.0",
    "project_id": "11111111-1111-4111-8111-111111111111",
    "connection_id": "22222222-2222-4222-8222-222222222222",
    "name": "python-probe",
    "command": {
      "interpreter": "python3",
      "script": "main.py",
      "arguments": [
        "--seed",
        "42"
      ]
    },
    "environment": {
      "id": "33333333-3333-4333-8333-333333333333",
      "revision_sha256": "bbbbbbbbbbbbbbbbbbbbbbbbbbbbbbbbbbbbbbbbbbbbbbbbbbbbbbbbbbbbbbbb"
    },
    "resources": {
      "nodes": 1,
      "cpus": 8,
      "gpus": 1,
      "gpu_type": "a100",
      "memory_mib": 16384,
      "time_limit_seconds": 3600
    },
    "slurm": {
      "partition": "gpu",
      "account": "research",
      "qos": "normal"
    },
    "files": [
      {
        "path": "main.py",
        "sha256": "aaaaaaaaaaaaaaaaaaaaaaaaaaaaaaaaaaaaaaaaaaaaaaaaaaaaaaaaaaaaaaaa",
        "size_bytes": 128,
        "executable": false
      }
    ],
    "outputs": [
      "results/metrics.json"
    ]
  },
  "files": [
    {
      "path": "_broker/batch.sh",
      "sha256": "cccccccccccccccccccccccccccccccccccccccccccccccccccccccccccccccc",
      "size_bytes": 512,
      "executable": true
    },
    {
      "path": "_broker/environment.sh",
      "sha256": "dddddddddddddddddddddddddddddddddddddddddddddddddddddddddddddddd",
      "size_bytes": 256,
      "executable": false
    },
    {
      "path": "main.py",
      "sha256": "aaaaaaaaaaaaaaaaaaaaaaaaaaaaaaaaaaaaaaaaaaaaaaaaaaaaaaaaaaaaaaaa",
      "size_bytes": 128,
      "executable": false
    }
  ],
  "batch_script": "_broker/batch.sh",
  "environment_wrapper": "_broker/environment.sh",
  "maximum_allocation": {
    "cpu_cores": 8,
    "gpu_devices": 1,
    "time_limit_seconds": 3600,
    "maximum_charge_duration_seconds": 3600
  },
  "reservation": {
    "cpu_core_seconds": 28800,
    "gpu_device_seconds": 3600
  },
  "connection_revision_sha256": "ffffffffffffffffffffffffffffffffffffffffffffffffffffffffffffffff"
}
